Index,Project Title,Abstract
28,AquaVision : Real Time Identification of Microbes in Fresh water using ML,The system combines the use of image processing and neural networks to detect an early presence of bacterial activity. We present here a proof of concept with some tests results. Our initial findings are very promising and indicate detection of viable bacterial cells within a period of 2 h. To the authors’ knowledge this is the first attempt to quantify viable bacterial cells in a water sample using cell splitting.
29, Medical Chatbot,"Medical chatbots are AI-powered conversational solutions that help patients, insurance companies, and healthcare providers easily connect with each other. These bots can also play a critical role in making relevant healthcare information accessible to the right stakeholders, at the right time."
30,Information Extraction from Medical Reports,"Electronic medical records (EMRs) are revolutionizing health-related research. One key issue for study quality is the accurate identification of patients with the condition of interest. Information in EMRs can be entered as structured codes or unstructured free text. The majority of research studies have used only coded parts of EMRs for case-detection, which may bias findings, miss cases, and reduce study quality. "
31,Secure file system ,"The Secure File System (SFS) provides transparent, end-to-end encryption support to users accessing files across any network. In this paper the architecture of the Secure File System is described."
32,Multi agent reinforcement learning and study of emergent behavior,"Interactive simulations with artificial groups or crowds offer a difficult control problem because the simulated people must exhibit very complex behaviors to be realistic. This complexity mainly depends on the simulated scenario and the size of the group being simulated. For instance, in many crowded scenarios, such us buildings, cities etc, artificial pedestrians must reflect intelligent path planning in very changing environments, as humans are constantly adjusting their speed to reflect congestion and other dynamic factors"
33,Third Man-The player performance indicator,"In a sport like football, in order for a team to be successful, each player must effectively undertake a specific role and a set of functions based on the position the play in on the field. Through a study carried out with 12 experts and 51 sport science students, they aimed to identify which are the most common performance indicators that should be evaluated in a player's performance based on their playing profile. "
35,ASK-L ( NLP Chatbot in Hindi/Marathi for banking purposes ),Chatbot acts like routing agent that can categorize user context in conversation. Chatbot helped with natural language processing (NLP) to analyze the request and extract some keyword information. In this system chatbot is designed according to query-based system in Marathi language (Indian Language). User asks the question to system; the system automatically replay all answer through chatbot
36,AI to build Architecture Floor Plan of buildings using GAN ,"This study aims to produce Andrea Palladio’s architectural plan schemes autonomously with generative adversarial networks(GAN), and to evaluate the plan drawing productions of GAN as a generative plan layout tool. GAN is a class of deep neural nets which is a generative model. In deep learning models, repetitive processes can be automated. Architectural drawing is a repetitive process in the act of architecture and plan drawing process can be made automated. For the automation of plan production system we used deep convolutional generative adversarial network (DCGAN) which is a subset of GAN models. And we evaluated the outputs of the DCGAN Palladian Plan scheme productions. Results show that not geometric similarities (shapes), but probabilistic models are at the centre of the generative system of GAN."
37,A Covid Tracker for the Medical Frontliners,Data for frontline healthcare workers (HCWs) and risk of SARS-CoV-2 infection are limited and whether personal protective equipment (PPE) mitigates this risk is unknown. We evaluated risk for COVID-19 among frontline HCWs compared to the general community and the influence of PPE.
39,market trend analysis for niche companies,"Essentials elements for a niche marketing strategy include segmentation, and positioning. The main purpose of the niche marketing is profitability, adherence to the marketing concept, relationship marketing practices, and building company reputation based on long term mutual benefit with its customers. Small firm must incorporate these ideas and become guerrilla marketers to compete successfully in markets dominated by much larger companies. To overcome these problems and potentially make effective use of niche marketing as a marketing strategy, the literature needs to advance a common definition, comprehensible elements, and most certainly common characteristics."
40,Face Mask Detection ,"Face Mask Detection Platform uses Artificial Network to recognize if a user is not wearing a mask.  The app can be connected to any existing or new IP mask detection cameras to detect people without a mask. App users can also add faces and phone numbers to send them an alert in case they are not wearing a mask. If the camera captures an unrecognized face, a notification can be sent out to the administrator."
41,drowsiness detection system,"The driver drowsiness detection is based on an algorithm, which begins recording the driver’s steering behavior the moment the trip begins. It then recognizes changes over the course of long trips, and thus also the driver’s level of fatigue. Typical signs of waning concentration are phases during which the driver is barely steering, combined with slight, yet quick and abrupt steering movements to keep the car on track."
